{
  "kind": "sealability_report.v0",
  "projection_hash": "proj:abc123",
  "source_boundary_hash": "boundary:abc123",
  "sealable": true,
  "doubt_summary": {
    "max_state": "known",
    "max_severity": 0,
    "counts": {"known": 1},
    "safe_to_continue": true,
    "safe_to_act": true
  },
  "requirements": [
    {"key": "source_boundary_explicit", "passed": true},
    {"key": "rights_attached", "passed": true}
  ],
  "context": {
    "rights": {"attached": true, "license": "internal"},
    "scorecard": {"exists": true, "trust_score": 0.82},
    "custody_policy": {"exists": true, "vault": "nas:minivault"},
    "revocation": {"exists": true, "method": "supersede"},
    "receipts": {"configured": true},
    "human_review": {"approved": true}
  },
  "report_hash": "sealability:abc123",
  "created_at": "2026-07-02T12:00:00Z"
}
